{
  "contract": "fs-observer/foundation-case-pack-manifest/1",
  "pack_id": "fsp.foundation.case005",
  "version": "1.0.0-alpha.1",
  "classification": "SYNTHETIC",
  "engine_source": {
    "id": "full-spectrum-engine",
    "version": "v1.0.0",
    "schema_version": "1.0.0",
    "source_commit": "09062bae2c7608bda79ee4bfde5779109e8e6197"
  },
  "engine_artifact": {
    "status": "PENDING_VG3",
    "sha256": null
  },
  "case": {
    "case_id": "CASE005_KNOWLEDGE_CONFLICT",
    "seed": 42,
    "fixed_time_utc": "2026-07-04T00:00:00Z",
    "input_sha256": "70c5f2c585556fd355ac0f3cb17121a5f9c3dd529d329e2dd2429d28804817da",
    "golden_sha256": "0b2bbeaeaf784e3b0c38910617ef03a9f02ad4a8b87adc42e84648979d3a365c"
  },
  "schemas": [
    {
      "id": "https://fullspectrumprotocol.com/schemas/observer/foundation-kernel/audit-event/1.0.0-alpha.1",
      "version": "1.0.0-alpha.1",
      "schema_version": "2020-12",
      "sha256": "e11358d1503b2ff0b1eb51027a12cd3b7609f5053df1640ead486800e82ab157",
      "source_commit": "09062bae2c7608bda79ee4bfde5779109e8e6197"
    },
    {
      "id": "https://fullspectrumprotocol.com/schemas/observer/foundation-kernel/engine-facade-request/1.0.0-alpha.1",
      "version": "1.0.0-alpha.1",
      "schema_version": "2020-12",
      "sha256": "6248b26e8e0e4d0a1722c4622fbbd208818edde8a44182f89d5aac32fa7c7e45",
      "source_commit": "09062bae2c7608bda79ee4bfde5779109e8e6197"
    },
    {
      "id": "https://fullspectrumprotocol.com/schemas/observer/foundation-kernel/engine-facade-response/1.0.0-alpha.1",
      "version": "1.0.0-alpha.1",
      "schema_version": "2020-12",
      "sha256": "bdd28cd993a88887b443b8c2639ab49d21e33bb865a9eec1ae995fae32cdbf65",
      "source_commit": "09062bae2c7608bda79ee4bfde5779109e8e6197"
    },
    {
      "id": "https://fullspectrumprotocol.com/schemas/observer/foundation-kernel/foundation-analysis-request/1.0.0-alpha.1",
      "version": "1.0.0-alpha.1",
      "schema_version": "2020-12",
      "sha256": "2d4bf2d26f800444ac83f9e72a374796a6aca17ee06b4caea8ef7a529a63e9ff",
      "source_commit": "09062bae2c7608bda79ee4bfde5779109e8e6197"
    },
    {
      "id": "https://fullspectrumprotocol.com/schemas/observer/foundation-kernel/foundation-case-pack-manifest/1.0.0-alpha.1",
      "version": "1.0.0-alpha.1",
      "schema_version": "2020-12",
      "sha256": "1ae8f54d89cc015adc05e9ad204d4ac4bae9584798206559cb43a6464c87e0cc",
      "source_commit": "09062bae2c7608bda79ee4bfde5779109e8e6197"
    },
    {
      "id": "https://fullspectrumprotocol.com/schemas/observer/foundation-kernel/foundation-error-envelope/1.0.0-alpha.1",
      "version": "1.0.0-alpha.1",
      "schema_version": "2020-12",
      "sha256": "142a7a55bb82cb567761efe8bc12cf70a0ab6a999f7f313da6dc4d9b66849d33",
      "source_commit": "09062bae2c7608bda79ee4bfde5779109e8e6197"
    },
    {
      "id": "https://fullspectrumprotocol.com/schemas/observer/foundation-kernel/foundation-operation-status/1.0.0-alpha.1",
      "version": "1.0.0-alpha.1",
      "schema_version": "2020-12",
      "sha256": "a9a5ffd2997a05f536d17459c7bfa32785405cd1642830b348234e65b5d348fe",
      "source_commit": "09062bae2c7608bda79ee4bfde5779109e8e6197"
    },
    {
      "id": "https://fullspectrumprotocol.com/schemas/observer/foundation-kernel/governance-output-envelope/1.0.0-alpha.1",
      "version": "1.0.0-alpha.1",
      "schema_version": "2020-12",
      "sha256": "79d0a85100573b132171e35981b80b2fdefb52852d626858f64715b6140dcfe5",
      "source_commit": "09062bae2c7608bda79ee4bfde5779109e8e6197"
    },
    {
      "id": "https://fullspectrumprotocol.com/schemas/observer/foundation-kernel/observation-record/1.0.0-alpha.1",
      "version": "1.0.0-alpha.1",
      "schema_version": "2020-12",
      "sha256": "356316e4c11a7f3b976a412f1b083ec8fdbb4a55b72afbdba0ed03c40d56b700",
      "source_commit": "09062bae2c7608bda79ee4bfde5779109e8e6197"
    },
    {
      "id": "https://fullspectrumprotocol.com/schemas/observer/foundation-kernel/release-manifest/1.0.0-alpha.1",
      "version": "1.0.0-alpha.1",
      "schema_version": "2020-12",
      "sha256": "708d9667a1ec24103ee647fac2757ea6f9cd95b46271c020af5f6443d9be2725",
      "source_commit": "09062bae2c7608bda79ee4bfde5779109e8e6197"
    },
    {
      "id": "https://fullspectrumprotocol.com/schemas/observer/foundation-kernel/runtime-configuration-snapshot/1.0.0-alpha.1",
      "version": "1.0.0-alpha.1",
      "schema_version": "2020-12",
      "sha256": "b3c423b33f87f3ff34beb8ac772910cc5ce93046185fd1ffbe1d4820f5e82d1b",
      "source_commit": "09062bae2c7608bda79ee4bfde5779109e8e6197"
    },
    {
      "id": "https://fullspectrumprotocol.com/schemas/observer/foundation-kernel/validation-result/1.0.0-alpha.1",
      "version": "1.0.0-alpha.1",
      "schema_version": "2020-12",
      "sha256": "88c7c100abe46d7c6a29a8efda3e12c3eb260d16d34e561249d51b1cfbb0dde0",
      "source_commit": "09062bae2c7608bda79ee4bfde5779109e8e6197"
    }
  ],
  "files": [
    {
      "artifact_id": "11111111-1111-4111-8111-111111111111",
      "media_type": "application/json",
      "sha256": "70c5f2c585556fd355ac0f3cb17121a5f9c3dd529d329e2dd2429d28804817da",
      "size_bytes": 828,
      "relative_path": "examples/case005-knowledge-conflict.input.json",
      "classification": "SYNTHETIC"
    },
    {
      "artifact_id": "22222222-2222-4222-8222-222222222222",
      "media_type": "application/json",
      "sha256": "0b2bbeaeaf784e3b0c38910617ef03a9f02ad4a8b87adc42e84648979d3a365c",
      "size_bytes": 9541,
      "relative_path": "examples/case005-knowledge-conflict.engine-golden.json",
      "classification": "SYNTHETIC"
    }
  ],
  "manifest_sha256": "f52a3faa808afbaed66cdae622c72cf033163fc1f4af467fd92e5f61016e6c0e"
}
